{
  "address": "0xacEAdDba2B55c93A3d538fA9c34E71B0f3206945",
  "abi": [
    {
      "inputs": [
        {
          "internalType": "address",
          "name": "_proxyTo",
          "type": "address"
        }
      ],
      "stateMutability": "nonpayable",
      "type": "constructor"
    },
    {
      "anonymous": false,
      "inputs": [
        {
          "indexed": false,
          "internalType": "address",
          "name": "_new",
          "type": "address"
        },
        {
          "indexed": false,
          "internalType": "address",
          "name": "_old",
          "type": "address"
        }
      ],
      "name": "ProxyOwnerUpdate",
      "type": "event"
    },
    {
      "anonymous": false,
      "inputs": [
        {
          "indexed": true,
          "internalType": "address",
          "name": "_new",
          "type": "address"
        },
        {
          "indexed": true,
          "internalType": "address",
          "name": "_old",
          "type": "address"
        }
      ],
      "name": "ProxyUpdated",
      "type": "event"
    },
    {
      "stateMutability": "payable",
      "type": "fallback"
    },
    {
      "inputs": [],
      "name": "implementation",
      "outputs": [
        {
          "internalType": "address",
          "name": "",
          "type": "address"
        }
      ],
      "stateMutability": "view",
      "type": "function"
    },
    {
      "inputs": [],
      "name": "proxyOwner",
      "outputs": [
        {
          "internalType": "address",
          "name": "",
          "type": "address"
        }
      ],
      "stateMutability": "view",
      "type": "function"
    },
    {
      "inputs": [],
      "name": "proxyType",
      "outputs": [
        {
          "internalType": "uint256",
          "name": "proxyTypeId",
          "type": "uint256"
        }
      ],
      "stateMutability": "pure",
      "type": "function"
    },
    {
      "inputs": [
        {
          "internalType": "address",
          "name": "newOwner",
          "type": "address"
        }
      ],
      "name": "transferProxyOwnership",
      "outputs": [],
      "stateMutability": "nonpayable",
      "type": "function"
    },
    {
      "inputs": [
        {
          "internalType": "address",
          "name": "_newProxyTo",
          "type": "address"
        },
        {
          "internalType": "bytes",
          "name": "data",
          "type": "bytes"
        }
      ],
      "name": "updateAndCall",
      "outputs": [],
      "stateMutability": "payable",
      "type": "function"
    },
    {
      "inputs": [
        {
          "internalType": "address",
          "name": "_newProxyTo",
          "type": "address"
        }
      ],
      "name": "updateImplementation",
      "outputs": [],
      "stateMutability": "nonpayable",
      "type": "function"
    },
    {
      "stateMutability": "payable",
      "type": "receive"
    }
  ],
  "transactionHash": "0xe31d53fbd61e8111dc5f10af75645e3d9cc6df4474b0b941965d140b73fc638a",
  "receipt": {
    "to": null,
    "from": "0xC52a72eDdcA008580b4Efc89eA9f343AfF11FeA3",
    "contractAddress": "0xacEAdDba2B55c93A3d538fA9c34E71B0f3206945",
    "transactionIndex": 0,
    "gasUsed": "489316",
    "logsBloom": "0x00000000000000000000000000000000000000000000000000000000000000000000000000000000000000000000000000000000000000000000000000000000000000000000000000000000000000000000000000000000000000000000000000000000000000000000000000000000000000000000000000000000000000000000000000000000000000000000000000000000000000000000000000000000000000000000000000000000000000000000000000000000000000000000000000000000000000000000000000000000000000000000000000000000000000000000000000000000000000000000000000000000000000000000000000000000",
    "blockHash": "0x789414b8c321c08ed2312b052826b815f9ebc54d13901fa072b1b5fbcaa17f56",
    "transactionHash": "0xe31d53fbd61e8111dc5f10af75645e3d9cc6df4474b0b941965d140b73fc638a",
    "logs": [],
    "blockNumber": 24557190,
    "cumulativeGasUsed": "489316",
    "status": 1,
    "byzantium": true
  },
  "args": [
    "0xf680f9d67c8D91fB0fDc8AA7539f3c28f5c8D71F"
  ],
  "numDeployments": 1,
  "solcInputHash": "49d1e9b9ddfb8d34d2f756ae0084f3d9",
  "metadata": "{\"compiler\":{\"version\":\"0.8.19+commit.7dd6d404\"},\"language\":\"Solidity\",\"output\":{\"abi\":[{\"inputs\":[{\"internalType\":\"address\",\"name\":\"_proxyTo\",\"type\":\"address\"}],\"stateMutability\":\"nonpayable\",\"type\":\"constructor\"},{\"anonymous\":false,\"inputs\":[{\"indexed\":false,\"internalType\":\"address\",\"name\":\"_new\",\"type\":\"address\"},{\"indexed\":false,\"internalType\":\"address\",\"name\":\"_old\",\"type\":\"address\"}],\"name\":\"ProxyOwnerUpdate\",\"type\":\"event\"},{\"anonymous\":false,\"inputs\":[{\"indexed\":true,\"internalType\":\"address\",\"name\":\"_new\",\"type\":\"address\"},{\"indexed\":true,\"internalType\":\"address\",\"name\":\"_old\",\"type\":\"address\"}],\"name\":\"ProxyUpdated\",\"type\":\"event\"},{\"stateMutability\":\"payable\",\"type\":\"fallback\"},{\"inputs\":[],\"name\":\"implementation\",\"outputs\":[{\"internalType\":\"address\",\"name\":\"\",\"type\":\"address\"}],\"stateMutability\":\"view\",\"type\":\"function\"},{\"inputs\":[],\"name\":\"proxyOwner\",\"outputs\":[{\"internalType\":\"address\",\"name\":\"\",\"type\":\"address\"}],\"stateMutability\":\"view\",\"type\":\"function\"},{\"inputs\":[],\"name\":\"proxyType\",\"outputs\":[{\"internalType\":\"uint256\",\"name\":\"proxyTypeId\",\"type\":\"uint256\"}],\"stateMutability\":\"pure\",\"type\":\"function\"},{\"inputs\":[{\"internalType\":\"address\",\"name\":\"newOwner\",\"type\":\"address\"}],\"name\":\"transferProxyOwnership\",\"outputs\":[],\"stateMutability\":\"nonpayable\",\"type\":\"function\"},{\"inputs\":[{\"internalType\":\"address\",\"name\":\"_newProxyTo\",\"type\":\"address\"},{\"internalType\":\"bytes\",\"name\":\"data\",\"type\":\"bytes\"}],\"name\":\"updateAndCall\",\"outputs\":[],\"stateMutability\":\"payable\",\"type\":\"function\"},{\"inputs\":[{\"internalType\":\"address\",\"name\":\"_newProxyTo\",\"type\":\"address\"}],\"name\":\"updateImplementation\",\"outputs\":[],\"stateMutability\":\"nonpayable\",\"type\":\"function\"},{\"stateMutability\":\"payable\",\"type\":\"receive\"}],\"devdoc\":{\"kind\":\"dev\",\"methods\":{},\"version\":1},\"userdoc\":{\"kind\":\"user\",\"methods\":{},\"version\":1}},\"settings\":{\"compilationTarget\":{\"contracts/base/UpgradeableProxy.sol\":\"UpgradableProxy\"},\"evmVersion\":\"paris\",\"libraries\":{},\"metadata\":{\"bytecodeHash\":\"ipfs\",\"useLiteralContent\":true},\"optimizer\":{\"enabled\":true,\"runs\":200},\"remappings\":[]},\"sources\":{\"contracts/base/UpgradeableProxy.sol\":{\"content\":\"// SPDX-License-Identifier: AGPL-3.0-only\\r\\npragma solidity 0.8.19;\\r\\n\\r\\ninterface IERCProxy {\\r\\n    function proxyType() external pure returns (uint256 proxyTypeId);\\r\\n\\r\\n    function implementation() external view returns (address codeAddr);\\r\\n}\\r\\n\\r\\nabstract contract Proxy is IERCProxy {\\r\\n    function delegatedFwd(address implementation_) internal {\\r\\n        assembly {\\r\\n            // Copy msg.data. We take full control of memory in this inline assembly\\r\\n            // block because it will not return to Solidity code. We overwrite the\\r\\n            // Solidity scratch pad at memory position 0.\\r\\n            calldatacopy(0, 0, calldatasize())\\r\\n\\r\\n            // Call the implementation.\\r\\n            // out and outsize are 0 because we don't know the size yet.\\r\\n            let result := delegatecall(gas(), implementation_, 0, calldatasize(), 0, 0)\\r\\n\\r\\n            // Copy the returned data.\\r\\n            returndatacopy(0, 0, returndatasize())\\r\\n\\r\\n            switch result\\r\\n            // delegatecall returns 0 on error.\\r\\n            case 0 {\\r\\n                revert(0, returndatasize())\\r\\n            }\\r\\n            default {\\r\\n                return(0, returndatasize())\\r\\n            }\\r\\n        }\\r\\n    }\\r\\n\\r\\n    function proxyType() external pure virtual override returns (uint256 proxyTypeId) {\\r\\n        // Upgradeable proxy\\r\\n        proxyTypeId = 2;\\r\\n    }\\r\\n\\r\\n    function implementation() external view virtual override returns (address);\\r\\n}\\r\\n\\r\\ncontract UpgradableProxy is Proxy {\\r\\n    event ProxyUpdated(address indexed _new, address indexed _old);\\r\\n    event ProxyOwnerUpdate(address _new, address _old);\\r\\n\\r\\n    bytes32 constant IMPLEMENTATION_SLOT = keccak256('matic.network.proxy.implementation');\\r\\n    bytes32 constant OWNER_SLOT = keccak256('matic.network.proxy.owner');\\r\\n\\r\\n    constructor(address _proxyTo) {\\r\\n        setProxyOwner(msg.sender);\\r\\n        setImplementation(_proxyTo);\\r\\n    }\\r\\n\\r\\n    fallback() external payable {\\r\\n        delegatedFwd(loadImplementation());\\r\\n    }\\r\\n\\r\\n    receive() external payable {\\r\\n        delegatedFwd(loadImplementation());\\r\\n    }\\r\\n\\r\\n    modifier onlyProxyOwner() {\\r\\n        require(loadProxyOwner() == msg.sender, 'NOT_OWNER');\\r\\n        _;\\r\\n    }\\r\\n\\r\\n    function proxyOwner() external view returns (address) {\\r\\n        return loadProxyOwner();\\r\\n    }\\r\\n\\r\\n    function loadProxyOwner() internal view returns (address) {\\r\\n        address _owner;\\r\\n        bytes32 position = OWNER_SLOT;\\r\\n        assembly {\\r\\n            _owner := sload(position)\\r\\n        }\\r\\n        return _owner;\\r\\n    }\\r\\n\\r\\n    function implementation() external view override returns (address) {\\r\\n        return loadImplementation();\\r\\n    }\\r\\n\\r\\n    function loadImplementation() internal view returns (address) {\\r\\n        address _impl;\\r\\n        bytes32 position = IMPLEMENTATION_SLOT;\\r\\n        assembly {\\r\\n            _impl := sload(position)\\r\\n        }\\r\\n        return _impl;\\r\\n    }\\r\\n\\r\\n    function transferProxyOwnership(address newOwner) public onlyProxyOwner {\\r\\n        require(newOwner != address(0), 'ZERO_ADDRESS');\\r\\n        emit ProxyOwnerUpdate(newOwner, loadProxyOwner());\\r\\n        setProxyOwner(newOwner);\\r\\n    }\\r\\n\\r\\n    function setProxyOwner(address newOwner) private {\\r\\n        bytes32 position = OWNER_SLOT;\\r\\n        assembly {\\r\\n            sstore(position, newOwner)\\r\\n        }\\r\\n    }\\r\\n\\r\\n    function updateImplementation(address _newProxyTo) public onlyProxyOwner {\\r\\n        require(_newProxyTo != address(0x0), 'INVALID_PROXY_ADDRESS');\\r\\n        require(isContract(_newProxyTo), 'DESTINATION_ADDRESS_IS_NOT_A_CONTRACT');\\r\\n\\r\\n        emit ProxyUpdated(_newProxyTo, loadImplementation());\\r\\n\\r\\n        setImplementation(_newProxyTo);\\r\\n    }\\r\\n\\r\\n    function updateAndCall(address _newProxyTo, bytes memory data) public payable onlyProxyOwner {\\r\\n        updateImplementation(_newProxyTo);\\r\\n\\r\\n        (bool success, bytes memory returnData) = address(this).call{value: msg.value}(data);\\r\\n        require(success, string(returnData));\\r\\n    }\\r\\n\\r\\n    function setImplementation(address _newProxyTo) private {\\r\\n        bytes32 position = IMPLEMENTATION_SLOT;\\r\\n        assembly {\\r\\n            sstore(position, _newProxyTo)\\r\\n        }\\r\\n    }\\r\\n\\r\\n    function isContract(address _target) internal view returns (bool) {\\r\\n        if (_target == address(0)) {\\r\\n            return false;\\r\\n        }\\r\\n\\r\\n        uint256 size;\\r\\n        assembly {\\r\\n            size := extcodesize(_target)\\r\\n        }\\r\\n        return size > 0;\\r\\n    }\\r\\n}\\r\\n\",\"keccak256\":\"0x5d60f98ee2266f6d8c64b49adecafeaade52f9163c624c89738b254ab18dc6c9\",\"license\":\"AGPL-3.0-only\"}},\"version\":1}",
  "bytecode": "0x608060405234801561001057600080fd5b506040516107cd3803806107cd83398101604081905261002f91610085565b610057337f44f6e2e8884cba1236b7f22f351fa5d88b17292b7e0225ca47e5ecdf6055cdd655565b61007f817fbaab7dbf64751104133af04abc7d9979f0fda3b059a322a8333f533d3f32bf7f55565b506100b5565b60006020828403121561009757600080fd5b81516001600160a01b03811681146100ae57600080fd5b9392505050565b610709806100c46000396000f3fe6080604052600436106100595760003560e01c8063025313a214610097578063025b22bc146100c95780634555d5c9146100e95780635c60da1b14610105578063d88ca2c81461011a578063f1739cae1461012d5761007e565b3661007e5761007c6100776000805160206106b48339815191525490565b61014d565b005b61007c6100776000805160206106b48339815191525490565b3480156100a357600080fd5b506100ac610171565b6040516001600160a01b0390911681526020015b60405180910390f35b3480156100d557600080fd5b5061007c6100e4366004610503565b61018e565b3480156100f557600080fd5b50604051600281526020016100c0565b34801561011157600080fd5b506100ac6102ed565b61007c61012836600461053b565b610305565b34801561013957600080fd5b5061007c610148366004610503565b6103d5565b3660008037600080366000845af43d6000803e80801561016c573d6000f35b3d6000fd5b60006101896000805160206106948339815191525490565b905090565b336101a56000805160206106948339815191525490565b6001600160a01b0316146101d45760405162461bcd60e51b81526004016101cb906105fd565b60405180910390fd5b6001600160a01b0381166102225760405162461bcd60e51b8152602060048201526015602482015274494e56414c49445f50524f58595f4144445245535360581b60448201526064016101cb565b61022b816104c8565b6102855760405162461bcd60e51b815260206004820152602560248201527f44455354494e4154494f4e5f414444524553535f49535f4e4f545f415f434f4e60448201526415149050d560da1b60648201526084016101cb565b6000805160206106b4833981519152546001600160a01b0316816001600160a01b03167fd32d24edea94f55e932d9a008afc425a8561462d1b1f57bc6e508e9a6b9509e160405160405180910390a36102ea816000805160206106b483398151915255565b50565b60006101896000805160206106b48339815191525490565b3361031c6000805160206106948339815191525490565b6001600160a01b0316146103425760405162461bcd60e51b81526004016101cb906105fd565b61034b8261018e565b600080306001600160a01b031634846040516103679190610644565b60006040518083038185875af1925050503d80600081146103a4576040519150601f19603f3d011682016040523d82523d6000602084013e6103a9565b606091505b50915091508181906103ce5760405162461bcd60e51b81526004016101cb9190610660565b5050505050565b336103ec6000805160206106948339815191525490565b6001600160a01b0316146104125760405162461bcd60e51b81526004016101cb906105fd565b6001600160a01b0381166104575760405162461bcd60e51b815260206004820152600c60248201526b5a45524f5f4144445245535360a01b60448201526064016101cb565b7fdbe5fd65bcdbae152f24ab660ea68e72b4d4705b57b16e0caae994e214680ee28161048f6000805160206106948339815191525490565b604080516001600160a01b0393841681529290911660208301520160405180910390a16102ea8160008051602061069483398151915255565b60006001600160a01b0382166104e057506000919050565b503b151590565b80356001600160a01b03811681146104fe57600080fd5b919050565b60006020828403121561051557600080fd5b61051e826104e7565b9392505050565b634e487b7160e01b600052604160045260246000fd5b6000806040838503121561054e57600080fd5b610557836104e7565b9150602083013567ffffffffffffffff8082111561057457600080fd5b818501915085601f83011261058857600080fd5b81358181111561059a5761059a610525565b604051601f8201601f19908116603f011681019083821181831017156105c2576105c2610525565b816040528281528860208487010111156105db57600080fd5b8260208601602083013760006020848301015280955050505050509250929050565b6020808252600990820152682727aa2fa7aba722a960b91b604082015260600190565b60005b8381101561063b578181015183820152602001610623565b50506000910152565b60008251610656818460208701610620565b9190910192915050565b602081526000825180602084015261067f816040850160208701610620565b601f01601f1916919091016040019291505056fe44f6e2e8884cba1236b7f22f351fa5d88b17292b7e0225ca47e5ecdf6055cdd6baab7dbf64751104133af04abc7d9979f0fda3b059a322a8333f533d3f32bf7fa264697066735822122096166e217352f1cd629e7b9ace5f6601f64cd57ce0cd55daf6a46c51b717976464736f6c63430008130033",
  "deployedBytecode": "0x6080604052600436106100595760003560e01c8063025313a214610097578063025b22bc146100c95780634555d5c9146100e95780635c60da1b14610105578063d88ca2c81461011a578063f1739cae1461012d5761007e565b3661007e5761007c6100776000805160206106b48339815191525490565b61014d565b005b61007c6100776000805160206106b48339815191525490565b3480156100a357600080fd5b506100ac610171565b6040516001600160a01b0390911681526020015b60405180910390f35b3480156100d557600080fd5b5061007c6100e4366004610503565b61018e565b3480156100f557600080fd5b50604051600281526020016100c0565b34801561011157600080fd5b506100ac6102ed565b61007c61012836600461053b565b610305565b34801561013957600080fd5b5061007c610148366004610503565b6103d5565b3660008037600080366000845af43d6000803e80801561016c573d6000f35b3d6000fd5b60006101896000805160206106948339815191525490565b905090565b336101a56000805160206106948339815191525490565b6001600160a01b0316146101d45760405162461bcd60e51b81526004016101cb906105fd565b60405180910390fd5b6001600160a01b0381166102225760405162461bcd60e51b8152602060048201526015602482015274494e56414c49445f50524f58595f4144445245535360581b60448201526064016101cb565b61022b816104c8565b6102855760405162461bcd60e51b815260206004820152602560248201527f44455354494e4154494f4e5f414444524553535f49535f4e4f545f415f434f4e60448201526415149050d560da1b60648201526084016101cb565b6000805160206106b4833981519152546001600160a01b0316816001600160a01b03167fd32d24edea94f55e932d9a008afc425a8561462d1b1f57bc6e508e9a6b9509e160405160405180910390a36102ea816000805160206106b483398151915255565b50565b60006101896000805160206106b48339815191525490565b3361031c6000805160206106948339815191525490565b6001600160a01b0316146103425760405162461bcd60e51b81526004016101cb906105fd565b61034b8261018e565b600080306001600160a01b031634846040516103679190610644565b60006040518083038185875af1925050503d80600081146103a4576040519150601f19603f3d011682016040523d82523d6000602084013e6103a9565b606091505b50915091508181906103ce5760405162461bcd60e51b81526004016101cb9190610660565b5050505050565b336103ec6000805160206106948339815191525490565b6001600160a01b0316146104125760405162461bcd60e51b81526004016101cb906105fd565b6001600160a01b0381166104575760405162461bcd60e51b815260206004820152600c60248201526b5a45524f5f4144445245535360a01b60448201526064016101cb565b7fdbe5fd65bcdbae152f24ab660ea68e72b4d4705b57b16e0caae994e214680ee28161048f6000805160206106948339815191525490565b604080516001600160a01b0393841681529290911660208301520160405180910390a16102ea8160008051602061069483398151915255565b60006001600160a01b0382166104e057506000919050565b503b151590565b80356001600160a01b03811681146104fe57600080fd5b919050565b60006020828403121561051557600080fd5b61051e826104e7565b9392505050565b634e487b7160e01b600052604160045260246000fd5b6000806040838503121561054e57600080fd5b610557836104e7565b9150602083013567ffffffffffffffff8082111561057457600080fd5b818501915085601f83011261058857600080fd5b81358181111561059a5761059a610525565b604051601f8201601f19908116603f011681019083821181831017156105c2576105c2610525565b816040528281528860208487010111156105db57600080fd5b8260208601602083013760006020848301015280955050505050509250929050565b6020808252600990820152682727aa2fa7aba722a960b91b604082015260600190565b60005b8381101561063b578181015183820152602001610623565b50506000910152565b60008251610656818460208701610620565b9190910192915050565b602081526000825180602084015261067f816040850160208701610620565b601f01601f1916919091016040019291505056fe44f6e2e8884cba1236b7f22f351fa5d88b17292b7e0225ca47e5ecdf6055cdd6baab7dbf64751104133af04abc7d9979f0fda3b059a322a8333f533d3f32bf7fa264697066735822122096166e217352f1cd629e7b9ace5f6601f64cd57ce0cd55daf6a46c51b717976464736f6c63430008130033",
  "devdoc": {
    "kind": "dev",
    "methods": {},
    "version": 1
  },
  "userdoc": {
    "kind": "user",
    "methods": {},
    "version": 1
  },
  "storageLayout": {
    "storage": [],
    "types": null
  }
}